{
  "$schema": "../metadata/public-api.schema.json",
  "schemaVersion": 1,
  "contractVersion": "2.2.0",
  "status": "stable",
  "naming": {
    "cssClassPrefix": "g-",
    "cssCustomPropertyPrefix": "--g-",
    "dataAttributePrefix": "data-g-",
    "eventPrefix": "gardener:",
    "componentNames": "kebab-case",
    "behaviorNames": "kebab-case",
    "recipeIds": "dot-separated-kebab-case"
  },
  "css": {
    "layers": [
      "gardener.reset",
      "gardener.tokens",
      "gardener.base",
      "gardener.components",
      "gardener.utilities",
      "gardener.overrides"
    ],
    "entrypoints": [
      ".",
      "./min.css",
      "./core.css",
      "./core.min.css",
      "./themes.css",
      "./themes.min.css",
      "./utilities.css",
      "./utilities.min.css",
      "./components.css",
      "./components.min.css",
      "./ai.css",
      "./ai.min.css",
      "./platform/web.css",
      "./platform/mobile.css",
      "./platform/desktop.css",
      "./platform/tauri.css",
      "./platform/electron.css",
      "./component/*",
      "./component/*.css"
    ],
    "themeAttributes": [
      "data-g-theme",
      "data-g-mode",
      "data-g-neutral",
      "data-g-typography",
      "data-g-shape",
      "data-g-density",
      "data-g-elevation",
      "data-g-motion",
      "data-g-platform",
      "data-g-os"
    ]
  },
  "javascript": {
    "moduleExports": [
      "default",
      "Gardenerim",
      "init",
      "refresh",
      "destroy",
      "register",
      "getInstance",
      "emit",
      "toast",
      "observe",
      "disconnect",
      "start",
      "stop",
      "configure",
      "getConfiguration",
      "supportedLocales",
      "createNavigation",
      "navigationDefaults",
      "createTable"
    ],
    "moduleContracts": [
      {
        "name": "default",
        "kind": "object",
        "parameters": [],
        "returns": "Readonly<GardenerimAPI>",
        "signature": "default: Readonly<GardenerimAPI>"
      },
      {
        "name": "Gardenerim",
        "kind": "object",
        "parameters": [],
        "returns": "Readonly<GardenerimAPI>",
        "signature": "Gardenerim: Readonly<GardenerimAPI>"
      },
      {
        "name": "init",
        "kind": "function",
        "parameters": [
          "root = document"
        ],
        "returns": "Gardenerim",
        "signature": "init(root = document) => Gardenerim"
      },
      {
        "name": "refresh",
        "kind": "function",
        "parameters": [
          "root = document"
        ],
        "returns": "Gardenerim",
        "signature": "refresh(root = document) => Gardenerim"
      },
      {
        "name": "destroy",
        "kind": "function",
        "parameters": [
          "root = document"
        ],
        "returns": "void",
        "signature": "destroy(root = document) => void"
      },
      {
        "name": "register",
        "kind": "function",
        "parameters": [
          "name",
          "factory"
        ],
        "returns": "void",
        "signature": "register(name, factory) => void"
      },
      {
        "name": "getInstance",
        "kind": "function",
        "parameters": [
          "elementOrSelector",
          "name?"
        ],
        "returns": "instance | instances | null",
        "signature": "getInstance(elementOrSelector, name?) => instance | instances | null"
      },
      {
        "name": "emit",
        "kind": "function",
        "parameters": [
          "element",
          "name",
          "detail = {}"
        ],
        "returns": "boolean",
        "signature": "emit(element, name, detail = {}) => boolean"
      },
      {
        "name": "toast",
        "kind": "function",
        "parameters": [
          "options = {}"
        ],
        "returns": "HTMLElement",
        "signature": "toast(options = {}) => HTMLElement"
      },
      {
        "name": "observe",
        "kind": "function",
        "parameters": [
          "root = document",
          "options = {}"
        ],
        "returns": "{ disconnect(): void }",
        "signature": "observe(root = document, options = {}) => { disconnect(): void }"
      },
      {
        "name": "disconnect",
        "kind": "function",
        "parameters": [],
        "returns": "void",
        "signature": "disconnect() => void"
      },
      {
        "name": "start",
        "kind": "function",
        "parameters": [
          "root = document",
          "options = {}"
        ],
        "returns": "Gardenerim",
        "signature": "start(root = document, options = {}) => Gardenerim"
      },
      {
        "name": "stop",
        "kind": "function",
        "parameters": [
          "options = {}"
        ],
        "returns": "void",
        "signature": "stop(options = {}) => void"
      },
      {
        "name": "configure",
        "kind": "function",
        "parameters": [
          "options = {}"
        ],
        "returns": "GardenerimConfiguration",
        "signature": "configure(options = {}) => GardenerimConfiguration"
      },
      {
        "name": "getConfiguration",
        "kind": "function",
        "parameters": [],
        "returns": "GardenerimConfiguration",
        "signature": "getConfiguration() => GardenerimConfiguration"
      },
      {
        "name": "supportedLocales",
        "kind": "object",
        "parameters": [],
        "returns": "readonly string[]",
        "signature": "supportedLocales: readonly string[]"
      },
      {
        "name": "createNavigation",
        "kind": "function",
        "parameters": [
          "host",
          "options"
        ],
        "returns": "GardenerimNavigationInstance",
        "signature": "createNavigation(host, options) => GardenerimNavigationInstance"
      },
      {
        "name": "navigationDefaults",
        "kind": "object",
        "parameters": [],
        "returns": "Readonly<GardenerimNavigationOptions>",
        "signature": "navigationDefaults: Readonly<GardenerimNavigationOptions>"
      },
      {
        "name": "createTable",
        "kind": "function",
        "parameters": [
          "element",
          "options"
        ],
        "returns": "GardenerimTableInstance",
        "signature": "createTable(element, options) => GardenerimTableInstance"
      }
    ],
    "gardenerProperties": [
      "version",
      "behaviors",
      "started",
      "init",
      "refresh",
      "destroy",
      "register",
      "getInstance",
      "emit",
      "toast",
      "observe",
      "disconnect",
      "start",
      "stop",
      "configure",
      "getConfiguration",
      "locale",
      "supportedLocales"
    ],
    "behaviorAttributePattern": "data-g-{behavior}",
    "behaviors": [
      "dialog",
      "drawer",
      "mobile-sheet",
      "dropdown",
      "stepper",
      "tag",
      "tabs",
      "accordion",
      "auto-resize",
      "combobox",
      "password-toggle",
      "clear-input",
      "otp-input",
      "password-strength",
      "auth-timer",
      "quantity-stepper",
      "sku-selector",
      "cart",
      "coupon",
      "pull-refresh",
      "infinite-load",
      "swipe-actions",
      "wheel-picker",
      "ai-composer",
      "prompt-fill",
      "ai-approval",
      "ai-feedback",
      "shortcut-recorder",
      "desktop-tabs",
      "native-file-picker",
      "window-switcher",
      "character-count",
      "field-sync",
      "conditional-field",
      "rating",
      "validation-summary",
      "repeatable-field",
      "tooltip",
      "popover",
      "tour",
      "carousel",
      "split-pane",
      "foundation",
      "tree",
      "data-grid",
      "data-display",
      "dashboard",
      "interaction",
      "content",
      "layout",
      "help",
      "ai",
      "media",
      "auth",
      "mobile",
      "workflow",
      "communication",
      "legal",
      "solution",
      "desktop",
      "enterprise",
      "marketing",
      "cms",
      "commerce",
      "table-scroll",
      "table-density",
      "filter-summary",
      "table-sort",
      "row-select",
      "row-disclosure",
      "column-toggle",
      "data-filter",
      "data-view",
      "transfer",
      "picker",
      "cascader",
      "range-picker",
      "saved-choice",
      "builder-list",
      "toast",
      "copy",
      "fullscreen",
      "scroll-top",
      "dropzone",
      "nav-toggle",
      "roving-nav",
      "context-menu",
      "scrollspy",
      "jump-nav",
      "upload-manager",
      "file-browser",
      "media-player",
      "editor-shell",
      "revision-compare",
      "autosave",
      "command-palette"
    ],
    "behaviorContracts": [
      {
        "name": "dialog",
        "attribute": "data-g-dialog",
        "instanceMembers": [
          "open",
          "close",
          "toggle",
          "isOpen",
          "setBusy",
          "complete",
          "destroy"
        ]
      },
      {
        "name": "drawer",
        "attribute": "data-g-drawer",
        "instanceMembers": [
          "open",
          "close",
          "toggle",
          "isOpen",
          "setBusy",
          "complete",
          "destroy"
        ]
      },
      {
        "name": "mobile-sheet",
        "attribute": "data-g-mobile-sheet",
        "instanceMembers": [
          "open",
          "close",
          "toggle",
          "isOpen",
          "setBusy",
          "complete",
          "destroy"
        ]
      },
      {
        "name": "dropdown",
        "attribute": "data-g-dropdown",
        "instanceMembers": [
          "open",
          "close",
          "toggle",
          "isOpen",
          "destroy"
        ]
      },
      {
        "name": "stepper",
        "attribute": "data-g-stepper",
        "instanceMembers": [
          "current",
          "select",
          "next",
          "previous",
          "refresh",
          "destroy"
        ]
      },
      {
        "name": "tag",